Company Name,Visits,Data Size,Date,Link,Company Details
hudsoncivil.com.au,60394,112GB,7/8/2024 20:48,http://ransomxifxwc5eteopdobynonjctkxxvap77yqifu2emfbecgbqdw6qd.onion/c45e7d6c-9cb5-46f7-80ae-41acfc31bd0a/,"Hudson Civil Products(HCP) has been synonymous with civil construction and supply in Tasmania for many years, supplying precast concrete and civil products to customers in a broad range of industries, delivering quality products and exceptional service.Our goal is simple – excellence – both in service and product.AtHudson Civil Productswe pride ourselves on manufacturing and supplying only the highest quality precast concrete elements for the civil, municipal, industrial, rural and domestic markets and to supply products to the commercial and domestic building market more broadly. With a uniquely skilled workforce, a high degree of industry credibility and reputation for excellence and innovation we have the ability to provide solutions on any project. While the majority of the products that we produce are used by a large client base, we also manufacture to one-off individual client specifications and can tailor our solutions to suit."
amplicon.com,62398,313gb,7/8/2024 16:04,http://ransomxifxwc5eteopdobynonjctkxxvap77yqifu2emfbecgbqdw6qd.onion/1c6447e5-a521-4ea1-9f8d-fb8f963a1087/,"Amplicon provide the marketplace with a wide range of advanced computer-based measurement and automation systems that can be customised,networked and bundled for easy integration, backed by a technically competent workforce with a highly developed engineering capability and a state of the art EMC test facility.Capture.PNG244.13 KBCapture2.PNG190.17 KBCapture3.PNG156.22 KBCapture4.PNG181.19 KB"
infotexim.pe<Auction>,60133,1.73TB,6/8/2024 13:48,http://ransomxifxwc5eteopdobynonjctkxxvap77yqifu2emfbecgbqdw6qd.onion/22c5ee50-96ff-4bfd-a221-d370b28b4346/,"LOGO.jpg91.87 KBInfoteximprovides comprehensive technological solutions in systems, electricity, security, and telecommunications. Their services include consulting, data center management, networking, biometric systems, and video surveillance. Unfortunately, their focus is not on securing their customers' data. We have stolen and locked their precious files and emails.Para los administradores de Infotexim:todos sus archivos y correos electrónicos fueron robados y bloqueados. Si no desea que los filtremos públicamente y avergoncemos a su empresa, únase a la sala de chat que proporcionamos para que podamos negociar una resolución mutuamente beneficiosa para esta situación.Cert_1.png920.23 KBCert_2.png735.22 KBID_1.png423.46 KBID_2.png625.79 KBMedical_1.png191.97 KBRUC.png158.62 KBServersCreds.png80.85 KBPlans_1.png915.18 KBCCTV_1.png1.21 MB"
www.sobha.com,59678,10Gb,6/8/2024 16:53,http://ransomxifxwc5eteopdobynonjctkxxvap77yqifu2emfbecgbqdw6qd.onion/b11785eb-54d4-45d9-9b65-8ada22e1a1f5/,"SOBHAepitomizes “passion at work” in totality. For us it is not only a catch phrase which sounds just right, rather we all strive to live it daily. It serves as our compass which guides us towards creating world class quality products and workmanship. It guides us to be transparent in all our dealings and adhere to delivery on time, each time.Our track record of being the most reliable and trustworthy builder with a repertoire of award winning properties across India speaks for itself. We changed the skyline in Bangalore, created landmark developments in Kerala and have stepped into Delhi – NCR, Chennai, Coimbatore, Mysore, Pune and many more to follow.SOBHA Ltd. is one of the finest real estate development companies in India – A trusted builder based out of Bangalore, since 1995.Stolen a very private data."
retaildatallc.com,65524,1Tb,2/8/2024 16:25,http://ransomxifxwc5eteopdobynonjctkxxvap77yqifu2emfbecgbqdw6qd.onion/3ca000d9-12f2-411e-a83e-115d5efbd50d/,"In 1988, Christy Cottrell saw that businesses were operating in silos, completely disconnected from their competitors and their customers. They were blind to what was happening in the market and unable to make informed decisions about their products, pricing, and marketing strategies.Cottrell, who had a background in grocery retail, founded RetailData to fill this need. The company originally focused on providing retailers with accurate and up-to-date pricing information, quickly becoming a leader in the retail intelligence industry.Today, RetailData is a leading provider of observational intelligence and auditing solutions for businesses of all sizes and industries. The company has a team of experienced professionals who are experts in collecting and analyzing data. RetailData helps businesses make better decisions by providing them with accurate and timely data on their competitors, pricing, and products."
www.bahia-principe.com,63610,1230GB,31/7/2024 10:24,http://ransomxifxwc5eteopdobynonjctkxxvap77yqifu2emfbecgbqdw6qd.onion/1be1ab2e-6241-4755-926f-02ce37138071/,"pic_GPI_1.png52.83 KBpic_GPI_4.png55.25 KBpic_GPI_5.png137.09 KBpic_GPI_6.png53.56 KBBahia Principe is currently offering PCR testing in designated areas of resorts in the Dominican Republic, Mexico and Jamaica.Description of the stolen data: Incident reports, tax reports, commercial reports (contracts), guest contracts, casino documents, HR documentation, procurement."
www.normandydiesel.fr,65189,280GB,12/7/2024 16:42,http://ransomxifxwc5eteopdobynonjctkxxvap77yqifu2emfbecgbqdw6qd.onion/a2fd3873-b9b5-4b58-b6af-2f1995aaeb5a/,"Normandy Diesel retails automobiles. The Company offers sale of new and used commercial vehicles, passenger cars, jeeps, and mini vans, as well as provides financing, maintenance contracts, spare parts, and accessories. Normandy Diesel serves customers in France.logo_NDIESEL.jpeg4.28 KBpic_NDIESEL_2.PNG281.66 KBpic_NDIESEL_5.PNG71.86 KBpic_NDIESEL_6.PNG99.92 KBpic_NDIESEL_7.PNG154.66 KB"
effinghamschools.com,65754,273GB,1/8/2024 16:03,http://ransomxifxwc5eteopdobynonjctkxxvap77yqifu2emfbecgbqdw6qd.onion/73a8c3dc-0743-4ac9-ab7b-197e886d971a/,"Our county's conservative yet progressive values and excellent schools are two of the reasons we are one of the fastest-growing areas in Georgia.Despite the tremendous growth the Effingham County School System is experiencing, the Board of Education continues to maintain a student-oriented focus.Low student / teacher ratios, quality, permanent classroom space, and innovative instructional programs help explain why students, on average, perform better than the state average.Strong parent, community and business support also contribute to our success as one of the most innovative school systems in Georgia."
mcdowallaffleck.com.au,61688,470GB,1/8/2024 10:31,http://ransomxifxwc5eteopdobynonjctkxxvap77yqifu2emfbecgbqdw6qd.onion/b0129df3-9a65-4993-bea3-efdd6958df3e/,"On July 24th, the company McDowall Affleck was attacked. The company's network was encrypted, and confidential data was extracted.A total of 470 gigabytes of data was uploaded to our server, including: all blueprints and documents related to past and current projects, quota documents, insurance documents, tender and contract documents, client and partner information, personal information of employees, and much more.The company's director, Stephen Connell, was personally notified several times with details about the incident and was informed that if he did not pay us, all the data would be published on our blog.Stephen ConnelPhone (Direct)+61 8 9217 2933phone+61 423 496 032Emailsconnell@mapl.net.auMichael Ferritto+61 419 923 268mferritto@mapl.net.auAdditionally, the company McDowall Affleck is insured by the cyber insurance company cfc.comAs we can see, this insurance company is not fulfilling its obligations at all. Therefore, we also recommend adding this company to the blacklist."
nydj.com,63904,411gb,31/7/2024 16:56,http://ransomxifxwc5eteopdobynonjctkxxvap77yqifu2emfbecgbqdw6qd.onion/3d9fb9b1-fad1-4d71-92d2-b1895ca5c6c6/,"Established in 2003 and headquartered in Los Angeles, California, NYDJ Apparel is an apparel brand specializing in jeans."
wgma.org,60931,109gb,31/7/2024 16:43,http://ransomxifxwc5eteopdobynonjctkxxvap77yqifu2emfbecgbqdw6qd.onion/92f23887-95c9-4c68-a85d-4f17205b97a7/,"Founded in 1968, the West Gulf Maritime Association is a non-profit maritime trade association with almost 300 members that include ship ownerswgma.org_logo.png31.2 KB1.PNG249.95 KB2.PNG174.92 KB3.PNG51.77 KB4.PNG82.25 KB5.PNG100.8 KB6.PNG56.88 KB"
verwarmingheyndrickx.be,65837,58G,30/7/2024 18:56,http://ransomxifxwc5eteopdobynonjctkxxvap77yqifu2emfbecgbqdw6qd.onion/7272ad87-e7af-4c69-8d2e-c1b0d3b5cf5d/,"Heyndrickx Service, central heating installer in ZwijndrechtHeyndrickx Service is a central heating installer in Zwijndrecht in the province of Antwerp in the region of1.PNG39.35 KB2.PNG52 KB3.PNG86.98 KBFlanders. The company is located at Sint-Annaboomstraat 63. Heyndrickx Service was founded on 16-03-2009.Heyndrickx Service specializes in all activities related to central heating. The company is known under company number 810463308. The company form is a bvba. The establishment at Sint-Annaboomstraat has 1-4 employees."
labor-koblenz.de,64824,304gb,29/7/2024 15:23,http://ransomxifxwc5eteopdobynonjctkxxvap77yqifu2emfbecgbqdw6qd.onion/371edd66-0dcf-4c1b-8156-246e5622bde8/,"MVZ Labor Koblenz provides order entry, practice support, blood bank, POCT management, pregnancy care, and blood collection services."
www.castelligroup.com,65955,300 GB,26/7/2024 20:44,http://ransomxifxwc5eteopdobynonjctkxxvap77yqifu2emfbecgbqdw6qd.onion/89febd3b-8b59-4cb9-94f2-2cf4b10bc2f6/,"castelli-default.png28.59 KBGood afternoon, Nuova Castelli!This is RansomHub hacker team.We want to make you aware that we have been in your network for a long time and have studied your companys business.We have downloaded hundreds of gigabytes of your data, which is being analyzed by our best experts.Also, we cannot reach an agreement, we will notify each customer of the data leak.If you ignore or refuse to deal, we will be forced to release all your details to the public.Our blog is being followed by many well-known media outlets, the case will be highly publicized and will cause devastating damage to your business.The only way to avoid this is to make a deal with us. Appoint a responsible person to negotiate and let's get down to business.Otherwise, every client will see how you have neglected their personal information and will have a detailed plan on how to win a case against you in court.1.png284.52 KB2.png732.97 KB3.png53.04 KB4.png184.56 KB5.png205.93 KB6.png539.01 KB7.png114.36 KBContact us, we have left you a message."
www.whittakersystem.com,67597,20Gb,26/7/2024 20:39,http://ransomxifxwc5eteopdobynonjctkxxvap77yqifu2emfbecgbqdw6qd.onion/854f0053-4291-4b85-a343-47d36243cf99/,"After 24 hours will be more screens with confidential data. After 48 hours ALL data will be published.Whittaker: The Best Carpet Cleaning System in the IndustryYour facility’s carpet appearance reflects your brand. And for this reason, the Whittaker Company is devoted to bringing the latest commercial carpet cleaning technology to you, backed by simple, straightforward customer service.At Whittaker, we are committed to demystifying the complexity of carpet maintenance by designing and delivering effective cleaning systems to allow you to achieve a consistently cleaner carpet appearance.OurSmart Care® Systemsare based on low-moisture encapsulation technology. Our latest advancements in carpet cleaners include an exclusive three-brush machine and a patented carpet agitator. We are proud of these advancements because they improve the user’s efficiency and reduce fatigue.TheSmart Care® Systemshave been developed for over 30 years and are approved by the Carpet and Rug Institute for interim and deep cleaning. In addition to being identified as the recommended cleaning system by multiple premier carpet manufacturers, ourCRYSTAL® Chemistryis both WoolSafe® and Green Seal® Certified.You can count on the WhittakerSmart Care® Systemsto provide you with consistently cleaner carpet and be well-supported by our exceptional customer service team. Every time.screen (1).png108.65 KBscreen (2).png141.62 KBscreen (3).png111.39 KB"
www.neurologicalinstitute.com,68408,Too much,22/7/2024 12:48,http://ransomxifxwc5eteopdobynonjctkxxvap77yqifu2emfbecgbqdw6qd.onion/b5fa11d7-c6c9-4404-b506-b949867ccaaf/,"logo.png121.89 KBGood afternoon, Neurological Spine Institute of Savannah!This is the RansomHub hacker team.We would like to inform you that we have been in your network for a long time and have been studying your company's business.We have not encrypted your network with no possibility of recovery, consider it a goodwill gesture. We are concerned about your patients.But, that won't keep you from leaking confidential and sensitive patient data. It's a huge blow to your reputation.We have downloaded hundreds of gigabytes of your data, which is now being analyzed by our best experts.If we can't reach an agreement, we will notify every patient of the data leak.If you ignore or refuse the deal, we will be forced to publish all your data in the public domain.Our blog is being followed by many prominent media outlets, the case will be highly publicized and will cause devastating damage to your business.The only way to avoid this is to make a deal with us. Appoint a responsible person to negotiate and get down to business.Otherwise, every patient in your clinic will see how you have neglected their personal information and will have a detailed plan to win their case against you in court.Prove to yourself and your patients and partners that their data is worth something to you.1.png120.05 KB2.png132.78 KB4.png518.13 KB5.png149.31 KBs8.png85.89 KB"
oficina.oficinadasfinancas.com.br,68734,4GB,24/7/2024 18:41,http://ransomxifxwc5eteopdobynonjctkxxvap77yqifu2emfbecgbqdw6qd.onion/55825816-1b0a-46d6-8533-d33bd21f9c7d/,"Oficina das Finanças is a course/study of finance company.We have gained access to all their files and webmails, and we have encrypted and stolen the servers private information.If a ransom payment is not made, we will leak all private documents, databases containing all data from customers, employees, partners, etc, webmails, and source code."
bpjaguar.com,68341,2GB,23/7/2024 23:33,http://ransomxifxwc5eteopdobynonjctkxxvap77yqifu2emfbecgbqdw6qd.onion/785e1b3d-0a98-47bb-ab50-d13e40aeb052/,"We at Ransomhub are contacting you to inform you that we have hacked your servers and completely compromised your data. As a result, all of your websites have been taken offline. We possess a significant amount of personal and legal data from your entire company. We suggest you get in touch with us via chat to negotiate for the decryptor so you can resume your operations."
ach.co.th,64646,5GB,23/7/2024 16:33,http://ransomxifxwc5eteopdobynonjctkxxvap77yqifu2emfbecgbqdw6qd.onion/4b1e197c-8468-4c9f-96c2-77e141cdbff6/,"ach.co.th /autoclickfastfit.com / hondamaliwan.comAutoCorp Group Holding is a vehicle parts/insurance company.We have gained access to all their files and webmails, and we have encrypted and stolen the servers private information.If a ransom payment is not made, we will leak all private documents, databases, webmails, and source code."
baytoti.com,65817,10Gb,25/7/2024 17:12,http://ransomxifxwc5eteopdobynonjctkxxvap77yqifu2emfbecgbqdw6qd.onion/8ea1378a-9ea6-4868-b508-d9feb99c1929/,"At Baytoti, we are committed to serve you an array of flavorful and delicious Chinese meals… Discover, indulge and satisfy your senses by savoring our aromatic and special delicacies. We always strive to offer a memorable and unique eating experience for our precious customers!Finance private data and other."
cminsulation.com,64830,10Gb,25/7/2024 17:10,http://ransomxifxwc5eteopdobynonjctkxxvap77yqifu2emfbecgbqdw6qd.onion/4f363626-643b-481f-b68f-52c2e315c477/,"CMI has a strong history of consistently delivering top-quality performance on schedule, all while tailoring to the individual needs of our clients and within budget. Our client list includes government agencies, private sector developers, and energy groups.Good private data."
panitchlaw.com,66466,unknown,25/7/2024 17:09,http://ransomxifxwc5eteopdobynonjctkxxvap77yqifu2emfbecgbqdw6qd.onion/8149574f-d45f-4a10-908a-f7ea3633ea2c/,"The team at Panitch Schwarze is composed entirely of IP practitioners with deep technical and legal knowledge and, as a result, our firm and our individual practitioners consistently receive accolades and top rankings by and among their peers.Don't want pay us. Now all their customers will know about hacked."
sigmacontrol.eu,65941,107gb,23/7/2024 16:17,http://ransomxifxwc5eteopdobynonjctkxxvap77yqifu2emfbecgbqdw6qd.onion/7c64c3b3-967c-4040-b78b-2e3851bc79fa/,"SigmaControl specializes in industrial automation and control, offering solutions like PLC systems, industrial monitors, industrial PCs, servo drives, and motors. They focus on enhancing productivity and efficiency across various industries with their engineering tools and remote management softwarescreen1_sigmacontrol.eu.PNG26.77 KBscreen2_sigmacontrol.eu.PNG139.67 KBscreen3_sigmacontrol.eu.PNG81.52 KBscreen4_sigmacontrol.eu.PNG81.61 KB"
www.byzan.com,72002,120gb,20/7/2024 12:57,http://ransomxifxwc5eteopdobynonjctkxxvap77yqifu2emfbecgbqdw6qd.onion/a73066bb-352e-4345-9606-57490ded02a2/,"Byzan Systems is a 14 year old, steadily growing IT Solutions Company. The company's objective is to provide cost effective and quality solutions on software consulting, customized applications, offshore development and systems support.Byzan's core competencies lie in the banking and financial services domain expertise by way of effective frameworks for Payment Gateways, Security and Authentication Models, Core Banking and Cross Channel Sales and Services. Byzan also provides services in the areas of Applications Support, LAN/WAN Datacenter and Support Desk Management for Electronic Banking.Byzan has its software development centers located in Mumbai and Chennai and support centers across all metros. Byzan today employs more than 250 experienced software professionals (BEs/BTechs/MCAs) with multi-country rollout experience.---------------------------------------We have provided the avenue for them to contact us to prevent the leak, but they chose to ignore us. Should they continue to do so, the rest of the data will be posted here.image.png259.03 KB"
www.garudafood.com,70705,10G,20/7/2024 18:47,http://ransomxifxwc5eteopdobynonjctkxxvap77yqifu2emfbecgbqdw6qd.onion/88314fe6-1b9f-49eb-9104-09d687c4746f/,"Garudafood Putra Putri Jaya Tbk is one of Indonesia's largest food and beverage companies. Founded in 1990, Garudafood business activities have been initiated since 1979 by the company's founder, Darmo PutroRevenue: 5.5BWe completely paralyzed their production and also downloaded some of their data. They have zero chances to recover without our help.We waited enough time and made it clear that we are going to publish all information if they don't cooperate.Due to arrogance of their recovery guy we have to make it public, but you still have some time to solve everything. Contact us through chat and finish the deal. We are waiting.Otherwise , we will publish all your data and you won't be able to recover.data.png273.13 KBCHOCOLATOS 66512822.pdf46.42 KBWCH8Chocolatos Choco Hazelnut.pdf46.54 KB"
www.kumagaigumi.co.jp,68517,5TB,19/7/2024 23:04,http://ransomxifxwc5eteopdobynonjctkxxvap77yqifu2emfbecgbqdw6qd.onion/5ae0b668-6eaf-4a6d-9802-505262fbf0b5/,"www.kumagaigumi.co.jpWe've been on your network for a long time and have had time to analyze your business.We have stolen over 5TB of your sensitive data.If you ignore or refuse to deal with us, we will be forced to make all your data2021上期_運用管理契約-明細-20210316.pdf1.15 MB01_サーバ利用者アカウント台帳.xlsx36.59 KB★引渡しに伴う付属書類目録.xlsx86.59 KB20230303.xdw58.99 KBpublic.Our blog is being monitored by many high profile media outlets, the case will be highly publicized and will cause devastating damage to your business.The only way to avoid this is to make a deal with us. Appoint a responsible person to negotiate and get down to business.Otherwise, every client will see how you have disregarded their personal information and they will have a detailed plan to win the case against you in court.we have all of your datas about Your contracts  Engineers and .... we attached some sample hereA8 緊急時連絡表(竣工後).pdf103.42 KB"
www.glowfm.nl,67901,20GB,16/7/2024 13:43,http://ransomxifxwc5eteopdobynonjctkxxvap77yqifu2emfbecgbqdw6qd.onion/5ac4f8d2-4179-4896-8d2a-897dd6db804b/,"glowfm.nlGlowFM is a radio/entertainment company.We have gained access to all their files and webmails, and we have encrypted and stolen the servers private information.If a ransom payment is not made, we will leak all private documents, databases, webmails, and source code."
metalfrio.com.br,73645,42GB,16/7/2024 18:06,http://ransomxifxwc5eteopdobynonjctkxxvap77yqifu2emfbecgbqdw6qd.onion/0450d743-ea60-4b29-809b-a843ba8f1c33/,"After going through the data extracted from Metalfrio Company. We were able to identify tons of sensitive data including and not limited to:- Products technical drawings (DWG,ANC,MNC, and more)- Financial information- Suppliers information- Clients information- Contracts & NDA agreements- Confidential data (includes financial records)- And many moreAs for the products technical drawings , specifications , and designs we are putting them up for sale.Any party interested in buying the intellectual property of the Metalfrio Manufacturing Group should contact us here through RansomHub admin.Below you will find sample sensitive documents and drawing extracted:1.png86.27 KB2.png103.63 KB3.png140.99 KB4.png89.59 KB5.png235.01 KBdwg.png43.44 KB"
www.erma-rtmo.it,73032,350 GB,14/7/2024 20:09,http://ransomxifxwc5eteopdobynonjctkxxvap77yqifu2emfbecgbqdw6qd.onion/2753322c-77d0-4085-84ef-1d37c2fc49e6/,"OIP.jfif4.38 KBWebsite:https://www.erma-group.comhttps://ermagroup.comGood afternoon, Erma!This is RansomHub hacker team.We want to make you aware that we have been in your network for a long time and have studied your companys business.We have downloaded hundreds of gigabytes of your data, which is being analyzed by our best experts.Also, we cannot reach an agreement, we will notify each customer of the data leak.If you ignore or refuse to deal, we will be forced to release all your details to the public.Our blog is being followed by many well-known media outlets, the case will be highly publicized and will cause devastating damage to your business.The only way to avoid this is to make a deal with us. Appoint a responsible person to negotiate and let's get down to business.Otherwise, every client will see how you have neglected their personal information and will have a detailed plan on how to win a case against you in court.1.png51.89 KB2.png83.69 KB3.png74.24 KB4.png63.34 KB5.png59.05 KB6.png146.91 KB7.png129.16 KB8.png629.61 KB9.png824.49 KB"
pgd.pl,71624,960gb,18/7/2024 11:15,http://ransomxifxwc5eteopdobynonjctkxxvap77yqifu2emfbecgbqdw6qd.onion/cb792430-16fe-49e9-87ac-514bcbb2ab20/,"PGD Group is Poland's first dealership group and a forerunner of multi-branding. The Group co-founded Holding 1, listed at 171st among the largest companies in Poland."
hlbpr.com,70692,4 GB,16/7/2024 8:07,http://ransomxifxwc5eteopdobynonjctkxxvap77yqifu2emfbecgbqdw6qd.onion/c7bc7bb4-84d5-4781-804b-e6b13c4b0c1e/,"1.PNG103.18 KB2.PNG20 KB3.PNG320.77 KB4.PNG243.3 KB5.PNG29.13 KBHLB Puerto Rico is a member of HLB International, the global advisory and accounting network; with over 400 independent accounting firms and business advisors in 158 countries and 50 years of experience. As a taxes, accounting and consulting ﬁrm, HLB Puerto Rico combines experience with boutique customer service to deliver ﬁnancial solutions to you and your business. Our HLB Global membership provides HLB Puerto Rico with the permanent international contact that a globalized economy demands while providing deep expertise upon local issues.HLB Puerto Rico combines the experience of its CPA’s professionals with the over 30 years of Luis R. Lomba CPA expertise. HLB Puerto Rico has the experts you can rely on your financials’, allowing you time to focus on growing your business."
ceopag.com.br / ceofood.com.br,67206,200GB,16/7/2024 1:54,http://ransomxifxwc5eteopdobynonjctkxxvap77yqifu2emfbecgbqdw6qd.onion/e0818352-e66e-48a0-947a-4b8bcf17fa52/,"CeoPag & CeoFood is a company operating in the field of payments.We have gained access to all their files and webmails, and we have encrypted and stolen the servers private information.If a ransom payment is not made, we will leak all private documents, databases, webmails, and source code. We have private information from over 6,000 restaurants and more than 600,000 customers.Affiliated companies included in the leak:ceopagceofoodailineevoluxbankoceanpayvaepayvibrapaysilverpaypulsebankexcellentpayuaipagusemobpaycooperativagontijobankpaxbancog8novuspayusapaybrasilgp3investjasperpayagenciajs"
www.hashem-contracting.com,21399,91 GB,13/12/2024 12:15,http://ransomxifxwc5eteopdobynonjctkxxvap77yqifu2emfbecgbqdw6qd.onion/9825d391-cfbc-4ab6-820c-61c3f09db798/,"Hashem Contracting and Trading Corp is a Riyadh, Saudilogo_HCTC-NETWORK.jpeg14.42 KBpic_HCTC-NETWORK.PNG134.51 KBArabia—based company specializing in general contractor and real estate development. Founded in 1978, it is engaged in the rental of commercial real estate and the implementation of major construction projects."
